data/macro_db/series/us.cefdfsa066msfrbphi.csv

date,value
1968-05-01,22.7
1968-06-01,25.3
1968-07-01,25.3
1968-08-01,18.5
1968-09-01,16
1968-10-01,22.9
1968-11-01,34
1968-12-01,25.8
1969-01-01,24.1
1969-02-01,35.2
1969-03-01,22.8
1969-04-01,25.9
1969-05-01,19.2
1969-06-01,19.7
1969-07-01,18.3
1969-08-01,16
1969-09-01,6.9
1969-10-01,9.3
1969-11-01,2.7
1969-12-01,-1.6
1970-01-01,4
1970-02-01,1
1970-03-01,9.7
1970-04-01,14.2
1970-05-01,6.4
1970-06-01,-1
1970-07-01,0.7
1970-08-01,5.1
1970-09-01,7.8
1970-10-01,5.7
1970-11-01,3
1970-12-01,5.2
1971-01-01,-1.1
1971-02-01,-0.6
1971-03-01,-0.9
1971-04-01,-10.7
1971-05-01,1.8
1971-06-01,4.1
1971-07-01,8.2
1971-08-01,15.7
1971-09-01,24.8
1971-10-01,18.2
1971-11-01,21.5
1971-12-01,30.2
1972-01-01,25.6
1972-02-01,38.7
1972-03-01,25.5
1972-04-01,31.1
1972-05-01,37.8
1972-06-01,41.1
1972-07-01,40.5
1972-08-01,31.7
1972-09-01,38.1
1972-10-01,37.4
1972-11-01,37.6
1972-12-01,43.9
1973-01-01,42.7
1973-02-01,40.8
1973-03-01,51.1
1973-04-01,32.8
1973-05-01,38.8
1973-06-01,29.6
1973-07-01,20.6
1973-08-01,36.5
1973-09-01,23.1
1973-10-01,26
1973-11-01,29
1973-12-01,25.2
1974-01-01,34.2
1974-02-01,9.5
1974-03-01,34.6
1974-04-01,35.4
1974-05-01,38
1974-06-01,29.2
1974-07-01,25.2
1974-08-01,8
1974-09-01,17.2
1974-10-01,8.5
1974-11-01,2.6
1974-12-01,5.9
1975-01-01,7.1
1975-02-01,6.3
1975-03-01,-10.9
1975-04-01,13.3
1975-05-01,10.3
1975-06-01,19.3
1975-07-01,24.6
1975-08-01,21.3
1975-09-01,19.9
1975-10-01,24.3
1975-11-01,34.7
1975-12-01,24.4
1976-01-01,24
1976-02-01,25.7
1976-03-01,35.2
1976-04-01,31
1976-05-01,36.6
1976-06-01,31.2
1976-07-01,34.6
1976-08-01,45.4
1976-09-01,42
1976-10-01,44.6
1976-11-01,42.5
1976-12-01,36.7
1977-01-01,34.6
1977-02-01,42.9
1977-03-01,36.3
1977-04-01,36.3
1977-05-01,33.1
1977-06-01,29
1977-07-01,32.2
1977-08-01,22.8
1977-09-01,35.3
1977-10-01,34.9
1977-11-01,30.1
1977-12-01,36.4
1978-01-01,32.2
1978-02-01,36.6
1978-03-01,28.1
1978-04-01,19
1978-05-01,24.5
1978-06-01,24.1
1978-07-01,7.6
1978-08-01,-2.7
1978-09-01,5.9
1978-10-01,11
1978-11-01,15.6
1978-12-01,19.7
1979-01-01,18.7
1979-02-01,13.4
1979-03-01,5
1979-04-01,17.6
1979-05-01,24.3
1979-06-01,26.9
1979-07-01,22.1
1979-08-01,22.9
1979-09-01,10.6
1979-10-01,17.4
1979-11-01,9.5
1979-12-01,-1.3
1980-01-01,17.9
1980-02-01,1.6
1980-03-01,19.6
1980-04-01,11.4
1980-05-01,3.5
1980-06-01,6.2
1980-07-01,17.1
1980-08-01,21
1980-09-01,20.7
1980-10-01,28.5
1980-11-01,29.1
1980-12-01,32.8
1981-01-01,15.3
1981-02-01,16.1
1981-03-01,18.9
1981-04-01,20.8
1981-05-01,19.8
1981-06-01,21.3
1981-07-01,41.1
1981-08-01,37.9
1981-09-01,36.7
1981-10-01,22.9
1981-11-01,14.2
1981-12-01,16.1
1982-01-01,15.5
1982-02-01,22.6
1982-03-01,12.7
1982-04-01,6.8
1982-05-01,6.5
1982-06-01,7
1982-07-01,12.1
1982-08-01,2.4
1982-09-01,10.7
1982-10-01,5.8
1982-11-01,7.4
1982-12-01,7.7
1983-01-01,4.9
1983-02-01,3.1
1983-03-01,17.6
1983-04-01,25.3
1983-05-01,27.6
1983-06-01,35.3
1983-07-01,21.6
1983-08-01,31.2
1983-09-01,24.5
1983-10-01,20.9
1983-11-01,38.2
1983-12-01,39.4
1984-01-01,44.6
1984-02-01,34.1
1984-03-01,37.2
1984-04-01,43.1
1984-05-01,29.8
1984-06-01,27.2
1984-07-01,14.6
1984-08-01,26.4
1984-09-01,26.7
1984-10-01,31.1
1984-11-01,20.7
1984-12-01,23.5
1985-01-01,26.6
1985-02-01,30
1985-03-01,22.8
1985-04-01,23.3
1985-05-01,21.1
1985-06-01,10.3
1985-07-01,13.1
1985-08-01,20.7
1985-09-01,3.9
1985-10-01,13.8
1985-11-01,22.7
1985-12-01,15.8
1986-01-01,28.9
1986-02-01,19.6
1986-03-01,12.9
1986-04-01,4.4
1986-05-01,2.2
1986-06-01,8.8
1986-07-01,9.5
1986-08-01,2.1
1986-09-01,0.4
1986-10-01,10.7
1986-11-01,20.3
1986-12-01,2.3
1987-01-01,1.2
1987-02-01,17.5
1987-03-01,6.2
1987-04-01,5.5
1987-05-01,16.7
1987-06-01,16.9
1987-07-01,7.7
1987-08-01,11.8
1987-09-01,28.1
1987-10-01,19.2
1987-11-01,14.1
1987-12-01,15.6
1988-01-01,9.7
1988-02-01,16.4
1988-03-01,24.4
1988-04-01,-0.7
1988-05-01,22.5
1988-06-01,22.7
1988-07-01,24.6
1988-08-01,25.1
1988-09-01,31.5
1988-10-01,26.5
1988-11-01,25.7
1988-12-01,39.6
1989-01-01,38.8
1989-02-01,24.1
1989-03-01,21.1
1989-04-01,27.9
1989-05-01,20.2
1989-06-01,9.8
1989-07-01,19.7
1989-08-01,21.4
1989-09-01,18.5
1989-10-01,1.4
1989-11-01,8.9
1989-12-01,7.5
1990-01-01,0.9
1990-02-01,-5.5
1990-03-01,-10.9
1990-04-01,1.6
1990-05-01,4.1
1990-06-01,8.4
1990-07-01,4.7
1990-08-01,4
1990-09-01,-11.1
1990-10-01,0.3
1990-11-01,-3
1990-12-01,5.4
1991-01-01,-7.3
1991-02-01,9.7
1991-03-01,9.9
1991-04-01,24.4
1991-05-01,16.2
1991-06-01,26.2
1991-07-01,28.7
1991-08-01,17
1991-09-01,14.7
1991-10-01,20.5
1991-11-01,13.7
1991-12-01,18
1992-01-01,24.4
1992-02-01,27.5
1992-03-01,22.6
1992-04-01,18.5
1992-05-01,15.5
1992-06-01,33.8
1992-07-01,21.5
1992-08-01,22.3
1992-09-01,27
1992-10-01,24
1992-11-01,15.4
1992-12-01,20.5
1993-01-01,23.5
1993-02-01,20.6
1993-03-01,27.2
1993-04-01,19.6
1993-05-01,18.4
1993-06-01,11.6
1993-07-01,-2.4
1993-08-01,14.7
1993-09-01,19.2
1993-10-01,23.9
1993-11-01,31.8
1993-12-01,22.4
1994-01-01,21.5
1994-02-01,20.6
1994-03-01,29.9
1994-04-01,21.9
1994-05-01,30.3
1994-06-01,25
1994-07-01,27.1
1994-08-01,24.3
1994-09-01,16.8
1994-10-01,24.1
1994-11-01,31.7
1994-12-01,11.3
1995-01-01,27.2
1995-02-01,12
1995-03-01,8.8
1995-04-01,11.1
1995-05-01,6.6
1995-06-01,-8.8
1995-07-01,12.1
1995-08-01,17.1
1995-09-01,22.2
1995-10-01,15.9
1995-11-01,15.9
1995-12-01,20.2
1996-01-01,5.9
1996-02-01,15.9
1996-03-01,4
1996-04-01,29.8
1996-05-01,21.7
1996-06-01,16.4
1996-07-01,19.5
1996-08-01,10
1996-09-01,13.5
1996-10-01,15.8
1996-11-01,19.4
1996-12-01,14.2
1997-01-01,12.9
1997-02-01,19.1
1997-03-01,17.1
1997-04-01,14.5
1997-05-01,16.7
1997-06-01,23.8
1997-07-01,14.9
1997-08-01,16.1
1997-09-01,16.6
1997-10-01,15.1
1997-11-01,19
1997-12-01,22.8
1998-01-01,17.7
1998-02-01,16.2
1998-03-01,21.8
1998-04-01,22.4
1998-05-01,16.6
1998-06-01,20.8
1998-07-01,9.9
1998-08-01,19.5
1998-09-01,2.5
1998-10-01,9.5
1998-11-01,16.5
1998-12-01,10.7
1999-01-01,20.8
1999-02-01,23.3
1999-03-01,19.9
1999-04-01,23.7
1999-05-01,23
1999-06-01,21.6
1999-07-01,16.9
1999-08-01,22
1999-09-01,23.6
1999-10-01,24.4
1999-11-01,19.5
1999-12-01,15.7
2000-01-01,22.8
2000-02-01,38.4
2000-03-01,20.2
2000-04-01,14.4
2000-05-01,20
2000-06-01,12.2
2000-07-01,24.9
2000-08-01,23.6
2000-09-01,32.1
2000-10-01,24.3
2000-11-01,16.5
2000-12-01,25
2001-01-01,5.9
2001-02-01,-6.2
2001-03-01,4.8
2001-04-01,2
2001-05-01,9
2001-06-01,1.5
2001-07-01,1.7
2001-08-01,5.8
2001-09-01,9.4
2001-10-01,8
2001-11-01,-0.5
2001-12-01,10.3
2002-01-01,24
2002-02-01,9.7
2002-03-01,10.5
2002-04-01,14.3
2002-05-01,12
2002-06-01,21.2
2002-07-01,21.9
2002-08-01,5.8
2002-09-01,16.9
2002-10-01,17.8
2002-11-01,24.4
2002-12-01,9.6
2003-01-01,9.7
2003-02-01,11.8
2003-03-01,16.9
2003-04-01,14.4
2003-05-01,9.2
2003-06-01,13.2
2003-07-01,14.4
2003-08-01,15.4
2003-09-01,13.8
2003-10-01,15.7
2003-11-01,16.3
2003-12-01,22.9
2004-01-01,22.5
2004-02-01,22.6
2004-03-01,20.4
2004-04-01,27.5
2004-05-01,22.6
2004-06-01,20.4
2004-07-01,27.8
2004-08-01,23.3
2004-09-01,20.6
2004-10-01,24.8
2004-11-01,24.5
2004-12-01,29.1
2005-01-01,20.6
2005-02-01,23.7
2005-03-01,26.9
2005-04-01,31.4
2005-05-01,15.9
2005-06-01,20.7
2005-07-01,13.3
2005-08-01,19.2
2005-09-01,13.3
2005-10-01,15.2
2005-11-01,22.7
2005-12-01,19.2
2006-01-01,16.4
2006-02-01,24
2006-03-01,22.8
2006-04-01,17.9
2006-05-01,17.9
2006-06-01,15.9
2006-07-01,15.8
2006-08-01,7.5
2006-09-01,14.2
2006-10-01,9.1
2006-11-01,20.1
2006-12-01,7.2
2007-01-01,21.2
2007-02-01,21.1
2007-03-01,27.2
2007-04-01,14
2007-05-01,12.1
2007-06-01,18.6
2007-07-01,17.2
2007-08-01,25.6
2007-09-01,16.9
2007-10-01,20.9
2007-11-01,8.1
2007-12-01,25.2
2008-01-01,16.5
2008-02-01,5.6
2008-03-01,3.2
2008-04-01,13.9
2008-05-01,17.1
2008-06-01,4.5
2008-07-01,6.3
2008-08-01,11.3
2008-09-01,13.4
2008-10-01,-3.7
2008-11-01,-9.9
2008-12-01,-18.3
2009-01-01,-16.7
2009-02-01,-16.3
2009-03-01,-16.9
2009-04-01,-3.6
2009-05-01,-2.3
2009-06-01,1.3
2009-07-01,0.4
2009-08-01,2.1
2009-09-01,-1.8
2009-10-01,7.9
2009-11-01,12.5
2009-12-01,12.6
2010-01-01,14.7
2010-02-01,23.8
2010-03-01,8.6
2010-04-01,10.9
2010-05-01,9
2010-06-01,2.6
2010-07-01,9.4
2010-08-01,15.7
2010-09-01,8.7
2010-10-01,23.2
2010-11-01,21.6
2010-12-01,30.1
2011-01-01,27.9
2011-02-01,13.2
2011-03-01,30.2
2011-04-01,20.3
2011-05-01,24.8
2011-06-01,10.5
2011-07-01,18.6
2011-08-01,10
2011-09-01,5.9
2011-10-01,15.4
2011-11-01,16.1
2011-12-01,13.7
2012-01-01,24
2012-02-01,15.6
2012-03-01,11
2012-04-01,21.6
2012-05-01,7.9
2012-06-01,13.7
2012-07-01,3.6
2012-08-01,9.8
2012-09-01,2.5
2012-10-01,2.3
2012-11-01,2.3
2012-12-01,16.7
2013-01-01,9.7
2013-02-01,16.1
2013-03-01,2.9
2013-04-01,8.4
2013-05-01,11.9
2013-06-01,21.5
2013-07-01,26.8
2013-08-01,19.5
2013-09-01,25.3
2013-10-01,26
2013-11-01,17.6
2013-12-01,13.6
2014-01-01,21.8
2014-02-01,22.1
2014-03-01,25.7
2014-04-01,24.6
2014-05-01,23.4
2014-06-01,28.7
2014-07-01,19.8
2014-08-01,15.6
2014-09-01,23.1
2014-10-01,22
2014-11-01,21.8
2014-12-01,22.6
2015-01-01,17.4
2015-02-01,23.3
2015-03-01,10.7
2015-04-01,15.7
2015-05-01,15
2015-06-01,11.4
2015-07-01,8.9
2015-08-01,15.8
2015-09-01,28.4
2015-10-01,9
2015-11-01,24.2
2015-12-01,8.1
2016-01-01,9.1
2016-02-01,4.7
2016-03-01,11.5
2016-04-01,11.6
2016-05-01,21.1
2016-06-01,10.6
2016-07-01,13
2016-08-01,18.5
2016-09-01,12.3
2016-10-01,23.4
2016-11-01,19.2
2016-12-01,30.7
2017-01-01,20.4
2017-02-01,22.4
2017-03-01,33
2017-04-01,35.6
2017-05-01,33.5
2017-06-01,29.6
2017-07-01,38.7
2017-08-01,41
2017-09-01,40.7
2017-10-01,41.4
2017-11-01,37.8
2017-12-01,35.8
2018-01-01,34.6
2018-02-01,37.8
2018-03-01,35.3
2018-04-01,30.6
2018-05-01,22
2018-06-01,35.6
2018-07-01,30.5
2018-08-01,31.4
2018-09-01,27.5
2018-10-01,28.5
2018-11-01,36.7
2018-12-01,32.6
2019-01-01,29.5
2019-02-01,30
2019-03-01,19.4
2019-04-01,31
2019-05-01,23.1
2019-06-01,28.3
2019-07-01,36.7
2019-08-01,26.3
2019-09-01,25.2
2019-10-01,37.5
2019-11-01,21.7
2019-12-01,25.8
2020-01-01,30.4
2020-02-01,29.1
2020-03-01,10.6
2020-04-01,12
2020-05-01,13.8
2020-06-01,27.5
2020-07-01,27
2020-08-01,26
2020-09-01,29.9
2020-10-01,37.5
2020-11-01,25.6
2020-12-01,23.8
2021-01-01,33.9
2021-02-01,26
2021-03-01,32.5
2021-04-01,36.4
2021-05-01,35.9
2021-06-01,41.9
2021-07-01,40.7
2021-08-01,36.9
2021-09-01,22.5
2021-10-01,35.6
2021-11-01,31.1
2021-12-01,20.1
2022-01-01,23.4
2022-02-01,20.2
2022-03-01,23.6
2022-04-01,19.6
2022-05-01,7.9
2022-06-01,13.5
2022-07-01,4.9
2022-08-01,21.3
2022-09-01,3.5
2022-10-01,7.6
2022-11-01,6.5
2022-12-01,18.2
2023-01-01,9
2023-02-01,7.1
2023-03-01,-3.9
2023-04-01,-4.4
2023-05-01,0.4
2023-06-01,12.7
2023-07-01,8
2023-08-01,-1
2023-09-01,4.3
2023-10-01,-3.4
2023-11-01,-4
2023-12-01,-5.2
2024-01-01,6.3
2024-02-01,11.3
2024-03-01,20.6
2024-04-01,20.2
2024-05-01,17.7
2024-06-01,14.9
2024-07-01,10.6
2024-08-01,13.8
2024-09-01,23.3
2024-10-01,24.6
2024-11-01,25.5
2024-12-01,20.9
2025-01-01,36.1
2025-02-01,14.5
2025-03-01,15.7
2025-04-01,4.4
2025-05-01,25.6
2025-06-01,17.2
2025-07-01,18.5
2025-08-01,39.1
2025-09-01,12
2025-10-01,24.4
2025-11-01,26.4
2025-12-01,29.1
2026-01-01,30.3
2026-02-01,14.4
2026-03-01,25.8
2026-04-01,35.2
2026-05-01,30.9
2026-06-01,41.2
2026-07-01,30.1
2026-08-01,48.2
2026-09-01,37.1
2026-10-01,34.9

notes/site-internal/dd/_src/2327.TW_20261103/prompts/judge.md

# Q3 2024 Earnings Call

Q3 2024 Earnings Call
Yageo Corporation | Earnings Calls | 2024-10-29
Howard Kao (Analysts)
Hello. Good afternoon, everyone, and thank you for joining us today for Yageo's Third Quarter Result
Webcast.
Yageo is the world's largest supplier of chip resistor and tantalum capacitors as well as a top 3 supplier
for MLCCs and inductors. My name is Howard Kao, and I'm the coverage analyst here at Morgan
Stanley.
We are very honored again to have Mr. David Wang, CEO; Mr. Eddie Chen, CFO; and Mr. Claudio
Lollini, Head of Global Sales and Marketing of Yageo here with us today. And we look forward to their
insights and comments on the company as well as the market.
The management team will first walk us through third quarter results and also provide some forward-
looking commentary. [Operator Instructions]
And I would now like to turn it over to Yageo's, Eddie and David for opening remarks.
Eddie Y.S. Chen (Executives)
Good afternoon, investors. Thank you for joining our third quarter earnings conference.
As usual, I'll kick off with a quick update on the third quarter financials and then followed by David,
and then questions.
Okay. So first, let's look at the third quarter financials. Basically, the third quarter has been a pretty
stable quarter compared to the previous one. You see from the selected items here, we have a pretty flat
sales in the third quarter coming in at $31.7 billion, about 1% growth from the previous quarter. Gross
margin pretty stable as well at 35.2% versus 35.1% in the previous or TWD 11.1 billion.
We're seeing very stable order in a very controlled fashion on the OpEx spending. So you see the OpEx
dollar third quarter come in at about TWD 4.5 billion roughly on the same level as the previous one. So
the operating profit at TWD 6.6 billion, 20.9%, slightly up from the previous quarter. On the non-op
front, we're generating about TWD 556 million in the third quarter largely due to the weakness in U.S.
dollar. So we've seen that level of non-op benefits slightly off than the previous quarter, but still
maintained at about 1.8% of sales.
Income before tax comes in at TWD 7.2 billion or 22.7%, slightly less than the previous quarter because
of the lower nonoperating performance, but then the income tax in the third quarter comes in at TWD
1.5 billion versus TWD 1.9 billion in the previous quarter, largely because we don't really have the
retained earning tax impact in the third quarter. So net income for the third quarter comes in at $5.7
billion or close to 18%, slightly better than the previous one.
And looking at the EPS in the third quarter is at TWD 11.01 per share. And this is on the -- after the
expanded capital base due to the [indiscernible] dividend distribution as well as some of the ECB
conversion. So we're talking about TWD 5 billion capital base in third quarter. So that EPS TWD 11,
slightly better than previous one at TWD 10.85.

EBITDA TWD 8.8 billion or TWD 8.9 billion were close to 28%, also slightly better than the previous
quarter as well. If we compare that to third quarter last year, you can see that the revenue is up almost
16%. This is largely because of the acquisition of the sales business that we completed October last year.
So it was not included in the third quarter of last year's results. You see the gross margin percentage
expanded a little bit as well due to the accretion of the acquisition, so 33.2% gross margin percentage
last year.
The OpEx was at 13.6% against 14.3% this quarter because the consolidation or the innovations going
on, we're seeing quarter-over-quarter improvement on the OpEx front. So we continue to have the
OpEx in a very controlled manner. So going down to the EBITDA margin percentage last year 27.3%
versus 27.9% this quarter. So again, accretion on the margin performance there as well.
Next page. Let's take a look at the year-to-date financials and compare that with last year, you can see
the year-to-date, we generated TWD 91.7 billion or a 14.2% increase over same period last year. And
gross margin overall improved from 33.1% to 34.7% year-to-date. OpEx 14% versus 15% this year. But
again, I think we're continuing to doing our best efforts to integrate the acquired business here. The
operating margin as well as the EBITDA margin were all showing some increments this year versus
same period last year.
Next. Let me walk you through some of the sales breakdown by different aspects for the third quarter.
You can see the quarter-over-quarter, I think the change is relatively marginal basically just plus/minus
1 percentage across the board. So MLCC, tantalum is just our magnetic sensor, maybe you are seeing a
marginal shift from quarter-to-quarter in the products.
Looking at the region, it's a pretty similar fashion as well. You can see Europe is showing a slight win
mix there, so marginally down by 1%. But then that's met by the Brazil and the rest of the Asia by about
1 percentage growth. So the mix by region hasn't really shifted that much.
Next slide. By channel, you can see that there's a swap between the EMS and direct sales by about 3%.
But all in all, the global distributors are still our main channel of recording ourselves at about 40%
there. Segment-wise, again, we're seeing more weakness in industrial sector in general, but that was
compensated by the resilience that we're seeing in computing and the enterprise systems there. So PC,
smartphones are all showing some improvements there.
Next. And here's an overview on the balance sheet. So as of the end of the third quarter, you can see the
cash balance for the company is at about TWD 94 billion, slightly up from the previous quarter. And the
-- basically, the balance sheet is fairly flat quarter-over-quarter at about TWD 358 billion. Inventory in
control as well; you can see that balance $26.8 billion versus the previous quarter, only showed about
1.3% increments there.
And on the liability front, we're able to continue to deleverage a little bit with the total liability comes in
at about TWD 203 billion and the net borrowing or the net financial debt of the company also came up
a little bit slightly less than TWD 23 billion versus TWD 24.5 billion in the previous quarter.
So if you look at the ratio of the net financial debt over equity at 14.7%, it's down by about 2.1
percentage points than previous quarter. Although we are now really back to below 10% net debt to
equity gearing level. Prior to the acquisitions last year, but then I think we're on the right track in terms
of continuing to see this trend in the balance sheet.